{
  "version": "1.0.0",
  "coverage": "OpenJLPT N5 CC BY-SA 4.0 plus curated additions",
  "target_count": 800,
  "items": [
    {
      "id": "vocab_001",
      "word": "会う",
      "reading": "あう",
      "meaning_en": "to meet",
      "level": "N5",
      "part_of_speech": "v5u; vi"
    },
    {
      "id": "vocab_002",
      "word": "青",
      "reading": "あお",
      "meaning_en": "blue",
      "level": "N5",
      "part_of_speech": "n; adj-no"
    },
    {
      "id": "vocab_003",
      "word": "青い",
      "reading": "あおい",
      "meaning_en": "blue",
      "level": "N5",
      "part_of_speech": "adj-i"
    },
    {
      "id": "vocab_004",
      "word": "赤",
      "reading": "あか",
      "meaning_en": "red",
      "level": "N5",
      "part_of_speech": "n; adj-no"
    },
    {
      "id": "vocab_005",
      "word": "赤い",
      "reading": "あかい",
      "meaning_en": "red",
      "level": "N5",
      "part_of_speech": "adj-i"
    },
    {
      "id": "vocab_006",
      "word": "明るい",
      "reading": "あかるい",
      "meaning_en": "bright",
      "level": "N5",
      "part_of_speech": "adj-i"
    },
    {
      "id": "vocab_007",
      "word": "秋",
      "reading": "あき",
      "meaning_en": "autumn",
      "level": "N5",
      "part_of_speech": "n; adv"
    },
    {
      "id": "vocab_008",
      "word": "開く",
      "reading": "あく",
      "meaning_en": "to open; to become open",
      "level": "N5",
      "part_of_speech": "v5k; vi"
    },
    {
      "id": "vocab_009",
      "word": "開ける",
      "reading": "あける",
      "meaning_en": "to open",
      "level": "N5",
      "part_of_speech": "v1; vt"
    },
    {
      "id": "vocab_010",
      "word": "上げる",
      "reading": "あげる",
      "meaning_en": "to give",
      "level": "N5",
      "part_of_speech": "v1; vt"
    },
    {
      "id": "vocab_011",
      "word": "朝",
      "reading": "あさ",
      "meaning_zh": "早晨",
      "meaning_en": "morning",
      "level": "N5",
      "part_of_speech": "n; adv"
    },
    {
      "id": "vocab_012",
      "word": "朝ごはん",
      "reading": "あさごはん",
      "meaning_en": "breakfast",
      "level": "N5",
      "part_of_speech": "n"
    },
    {
      "id": "vocab_013",
      "word": "あさって",
      "reading": "あさって",
      "meaning_en": "day after tomorrow",
      "level": "N5",
      "part_of_speech": "n; adv"
    },
    {
      "id": "vocab_014",
      "word": "足",
      "reading": "あし",
      "meaning_en": "foot; leg",
      "level": "N5",
      "part_of_speech": "n"
    },
    {
      "id": "vocab_015",
      "word": "明日",
      "reading": "あした",
      "meaning_zh": "明天",
      "meaning_en": "tomorrow",
      "level": "N5",
      "part_of_speech": "n; adv"
    },
    {
      "id": "vocab_016",
      "word": "あそこ",
      "reading": "あそこ",
      "meaning_zh": "那里（远处）",
      "meaning_en": "over there",
      "level": "N5",
      "part_of_speech": "pn"
    },
    {
      "id": "vocab_017",
      "word": "遊ぶ",
      "reading": "あそぶ",
      "meaning_en": "to play; to make a visit",
      "level": "N5",
      "part_of_speech": "v5b; vi"
    },
    {
      "id": "vocab_018",
      "word": "暖かい",
      "reading": "あたたかい",
      "meaning_en": "warm",
      "level": "N5",
      "part_of_speech": "adj-i"
    },
    {
      "id": "vocab_019",
      "word": "頭",
      "reading": "あたま",
      "meaning_en": "head",
      "level": "N5",
      "part_of_speech": "n"
    },
    {
      "id": "vocab_020",
      "word": "新しい",
      "reading": "あたらしい",
      "meaning_zh": "新",
      "meaning_en": "new",
      "level": "N5",
      "part_of_speech": "adj-i"
    },
    {
      "id": "vocab_021",
      "word": "あちら",
      "reading": "あちら",
      "meaning_en": "there",
      "level": "N5",
      "part_of_speech": "pn"
    },
    {
      "id": "vocab_022",
      "word": "厚い",
      "reading": "あつい",
      "meaning_en": "kind; deep; thick",
      "level": "N5",
      "part_of_speech": "adj-i"
    },
    {
      "id": "vocab_023",
      "word": "暑い",
      "reading": "あつい",
      "meaning_en": "hot",
      "level": "N5",
      "part_of_speech": "adj-i"
    },
    {
      "id": "vocab_024",
      "word": "熱い",
      "reading": "あつい",
      "meaning_en": "hot to the touch",
      "level": "N5",
      "part_of_speech": "adj-i"
    },
    {
      "id": "vocab_025",
      "word": "あっち",
      "reading": "あっち",
      "meaning_en": "over there",
      "level": "N5",
      "part_of_speech": "pn"
    },
    {
      "id": "vocab_026",
      "word": "後",
      "reading": "あと",
      "meaning_zh": "后面/之后",
      "meaning_en": "afterwards",
      "level": "N5",
      "part_of_speech": "n; adj-no"
    },
    {
      "id": "vocab_027",
      "word": "あなた",
      "reading": "あなた",
      "meaning_en": "you",
      "level": "N5",
      "part_of_speech": "pn"
    },
    {
      "id": "vocab_028",
      "word": "兄",
      "reading": "あに",
      "meaning_en": "(humble) older brother",
      "level": "N5",
      "part_of_speech": "n"
    },
    {
      "id": "vocab_029",
      "word": "姉",
      "reading": "あね",
      "meaning_en": "(humble) older sister",
      "level": "N5",
      "part_of_speech": "n"
    },
    {
      "id": "vocab_030",
      "word": "あの",
      "reading": "あの",
      "meaning_en": "that over there",
      "level": "N5",
      "part_of_speech": "adj-pn"
    },
    {
      "id": "vocab_031",
      "word": "アパート",
      "reading": "アパート",
      "meaning_en": "apartment",
      "level": "N5",
      "part_of_speech": "n"
    },
    {
      "id": "vocab_032",
      "word": "あびる",
      "reading": "あびる",
      "meaning_en": "to bathe; to shower",
      "level": "N5",
      "part_of_speech": "v1; vt"
    },
    {
      "id": "vocab_033",
      "word": "危ない",
      "reading": "あぶない",
      "meaning_en": "dangerous",
      "level": "N5",
      "part_of_speech": "adj-i"
    },
    {
      "id": "vocab_034",
      "word": "甘い",
      "reading": "あまい",
      "meaning_en": "sweet",
      "level": "N5",
      "part_of_speech": "adj-i"
    },
    {
      "id": "vocab_035",
      "word": "あまり",
      "reading": "あまり",
      "meaning_en": "not very",
      "level": "N5",
      "part_of_speech": "adv"
    },
    {
      "id": "vocab_036",
      "word": "飴",
      "reading": "あめ",
      "meaning_en": "candy",
      "level": "N5",
      "part_of_speech": "n"
    },
    {
      "id": "vocab_037",
      "word": "雨",
      "reading": "あめ",
      "meaning_zh": "雨",
      "meaning_en": "rain",
      "level": "N5",
      "part_of_speech": "n"
    },
    {
      "id": "vocab_038",
      "word": "洗う",
      "reading": "あらう",
      "meaning_en": "to wash",
      "level": "N5",
      "part_of_speech": "v5u; vt"
    },
    {
      "id": "vocab_039",
      "word": "ありがとう",
      "reading": "ありがとう",
      "meaning_zh": "谢谢",
      "meaning_en": "Thank you",
      "level": "N5",
      "part_of_speech": "int"
    },
    {
      "id": "vocab_040",
      "word": "ある",
      "reading": "ある",
      "meaning_en": "to be; to have (used for inanimate objects)",
      "level": "N5",
      "part_of_speech": "v5r-i; vi"
    },
    {
      "id": "vocab_041",
      "word": "歩く",
      "reading": "あるく",
      "meaning_en": "to walk",
      "level": "N5",
      "part_of_speech": "v5k; vi"
    },
    {
      "id": "vocab_042",
      "word": "あれ",
      "reading": "あれ",
      "meaning_zh": "那个（远处）",
      "meaning_en": "that",
      "level": "N5",
      "part_of_speech": "pn"
    },
    {
      "id": "vocab_043",
      "word": "いい",
      "reading": "いい",
      "meaning_en": "good",
      "level": "N5",
      "part_of_speech": "adj-ix"
    },
    {
      "id": "vocab_044",
      "word": "いいえ",
      "reading": "いいえ",
      "meaning_zh": "不是",
      "meaning_en": "no",
      "level": "N5",
      "part_of_speech": "int"
    },
    {
      "id": "vocab_045",
      "word": "言う",
      "reading": "いう",
      "meaning_en": "to say",
      "level": "N5",
      "part_of_speech": "v5u; vt"
    },
    {
      "id": "vocab_046",
      "word": "家",
      "reading": "いえ",
      "meaning_zh": "家",
      "meaning_en": "house",
      "level": "N5",
      "part_of_speech": "n"
    },
    {
      "id": "vocab_047",
      "word": "いかが",
      "reading": "いかが",
      "meaning_en": "how",
      "level": "N5",
      "part_of_speech": "adv"
    },
    {
      "id": "vocab_048",
      "word": "行く",
      "reading": "いく",
      "meaning_zh": "去",
      "meaning_en": "to go",
      "level": "N5",
      "part_of_speech": "v5k-s; vi"
    },
    {
      "id": "vocab_049",
      "word": "いくつ",
      "reading": "いくつ",
      "meaning_en": "how many?; how old?",
      "level": "N5",
      "part_of_speech": "adv"
    },
    {
      "id": "vocab_050",
      "word": "いくら",
      "reading": "いくら",
      "meaning_zh": "多少钱",
      "meaning_en": "how much?",
      "level": "N5",
      "part_of_speech": "n; adv"
    },
    {
      "id": "vocab_051",
      "word": "池",
      "reading": "いけ",
      "meaning_en": "pond",
      "level": "N5",
      "part_of_speech": "n"
    },
    {
      "id": "vocab_052",
      "word": "医者",
      "reading": "いしゃ",
      "meaning_en": "medical doctor",
      "level": "N5",
      "part_of_speech": "n"
    },
    {
      "id": "vocab_053",
      "word": "いす",
      "reading": "いす",
      "meaning_en": "chair",
      "level": "N5",
      "part_of_speech": "n"
    },
    {
      "id": "vocab_054",
      "word": "忙しい",
      "reading": "いそがしい",
      "meaning_zh": "忙",
      "meaning_en": "busy; irritated",
      "level": "N5",
      "part_of_speech": "adj-i"
    },
    {
      "id": "vocab_055",
      "word": "痛い",
      "reading": "いたい",
      "meaning_en": "painful",
      "level": "N5",
      "part_of_speech": "adj-i"
    },
    {
      "id": "vocab_056",
      "word": "いただきます",
      "reading": "いただきます",
      "meaning_en": "expression of gratitude before meals",
      "level": "N5",
      "part_of_speech": "exp"
    },
    {
      "id": "vocab_057",
      "word": "一",
      "reading": "いち",